datetime,player,channel,message
2026-03-16 15:57:37,tinus,online-boutique-8039,Hey everyone. I'm pumped today about our flash sale
2026-03-16 15:57:43,tinus,online-boutique-8039,You know it's been 56 years since the Beatles released Abbey Road right? My favourite album
2026-03-16 15:57:48,tanya,online-boutique-8039,56 years already?? Wow that makes me feel old...
2026-03-16 15:57:53,tinus,online-boutique-8039,Indeed! We're celebrating today by promoting a flash sale on retro items from 1969
2026-03-16 15:58:01,uptimelabs,online-boutique-8039,"Welcome to Bezs Beatles Day, remember communication is key to diagnose the problem.

 *Access game links by pressing the Uptime Labs Logo in the top right of the screen*
 *Use `/incident` to create an incident record*

Once you're ready just click start to begin"
