index,datetime,player,channel,message
226,23/10/2025 10:50,Maya,online-boutique-6427,Do we go ahead and mark this incident as closed?
227,23/10/2025 10:50,player10,private-comms-6427,Looks like the orders started again
228,23/10/2025 10:50,player10,private-comms-6427,Bob: Bez says:Keeping it high-level just say website restored but there's an issue with few orders. We'll refund them and customers will get a $10 gift voucher as an apology
229,23/10/2025 10:50,Bob,private-comms-6427,Understood!
231,23/10/2025 10:51,player10,online-boutique-6427,The issue resolved
232,23/10/2025 10:51,player10,online-boutique-6427,We will plan PIR
233,23/10/2025 10:51,Bez,business-comms-6427,Since services are restored I'm heading to speak with compliance and the regulators. Thankfully no data was leaked that helps
234,23/10/2025 10:51,Tanya,online-boutique-6427,That was intense. We've never been this close to total loss before. We got lucky
235,23/10/2025 10:51,Tinus,business-comms-6427,I'm on my way to the ICO (Information Commissioner's Office - UK) office now. I'll get the formal report rolling - that's required for the insurance claim. Keep monitoring in the meantime
236,23/10/2025 10:51,player10,business-comms-6427,The issue is now resolved
237,23/10/2025 10:51,Daniel,online-boutique-6427,Systems are calm now but that feeling earlier... not something I want to go through again
238,23/10/2025 10:51,Bob,online-boutique-6427,One small slip caused a major breach. We need better awareness to prevent this in future
239,23/10/2025 10:51,Tinus,online-boutique-6427,This could've gone way worse. Appreciate how quickly and cleanly you handled it
240,23/10/2025 10:52,Bez,online-boutique-6427,Not every day we survive an attack like this. You made the right calls fast. Great job @player10 - that's how we bounce back
242,23/10/2025 10:52,player10,online-boutique-6427,Clicked Start_feedback button\n