index,datetime,player,channel,message
203,06/10/2025 13:46,Bez,business-comms-6109,Since services are restored I'm heading to speak with compliance and the regulators. Thankfully no data was leaked that helps
204,06/10/2025 13:46,Tanya,online-boutique-6109,That was intense. We've never been this close to total loss before. We got lucky
205,06/10/2025 13:46,Tinus,business-comms-6109,I'm on my way to the ICO (Information Commissioner's Office - UK) office now. I'll get the formal report rolling - that's required for the insurance claim. Keep monitoring in the meantime
206,06/10/2025 13:47,Daniel,online-boutique-6109,Systems are calm now but that feeling earlier... not something I want to go through again
207,06/10/2025 13:47,Bob,online-boutique-6109,One small slip caused a major breach. We need better awareness to prevent this in future
208,06/10/2025 13:47,Tinus,online-boutique-6109,This could've gone way worse. Appreciate how quickly and cleanly you handled it
209,06/10/2025 13:47,Bez,online-boutique-6109,Not every day we survive an attack like this. You made the right calls fast. Great job @player6 - that's how we bounce back
211,06/10/2025 13:47,player6,online-boutique-6109,Thanks Bez
212,06/10/2025 13:47,player6,online-boutique-6109,Clicked Start_feedback button\n