index,datetime,player,channel,message
0,23/10/2025 10:09,Bez,online-boutique-6427,What a day! Our Grand Summer Sale kicked off this morning at 10 and the response has been insane. Can't believe we're already 5 hours in
1,23/10/2025 10:09,Bob,online-boutique-6427,Totally! Just checked the dashboard we've already crossed $160k+ in revenue :money_mouth_face: . The sale energy is next level!
2,23/10/2025 10:09,Tinus,online-boutique-6427,That's fantastic but hey this is just the beginning. Three days to go... I'm keeping my fingers crossed :crossed_fingers:
3,23/10/2025 10:09,Bez,online-boutique-6427,Seeing so many people shopping on a holiday it feels satisfying. Exactly the momentum we were hoping for
5,23/10/2025 10:12,player10,online-boutique-6427,Clicked Start button
7,23/10/2025 10:12,Shay,online-boutique-6427,Not this time! I just got a few alerts mentioning severe errors popping up in PROD
8,23/10/2025 10:12,Bob,online-boutique-6427,Weird... a few users just complained they are unable to complete their orders. Feels... off..
9,23/10/2025 10:13,player10,online-boutique-6427,Shay What are the alerts indicating?
10,23/10/2025 10:13,Shay,online-boutique-6427,There's checkout alerts I will check logs to find out more
11,23/10/2025 10:14,Shay,online-boutique-6427,Looking into logs now
12,23/10/2025 10:14,Bez,business-comms-6427,Customers have gone outrageous. #OBFail and #OBStealsSale are trending with frustrated posts. We're getting hammered online! Where are we @player10?
13,23/10/2025 10:14,Shay,online-boutique-6427,Found these below error logs
14,23/10/2025 10:14,Shay,online-boutique-6427,```\napp[checkout-service] [ERROR] - write() failed Read-only filesystem\napp[checkout-service] Order submission failed for session_id=ae43f9 due to I/O error\napp[checkout-service] [ERROR] - Transaction commit failed Read-only file system\n[ERROR] nginx[3245] - 502 Bad Gateway while accessing upstream checkout service\n[ERROR] nginx
15,23/10/2025 10:14,Shay,online-boutique-6427,The server is too slow and give up while responding back. I'm not sure why read-only errors are there
16,23/10/2025 10:14,Daniel,online-boutique-6427,Looking at the above logs app looks fine. But system can't write new data. Errors suggests to be an infra component failure
17,23/10/2025 10:14,Daniel,online-boutique-6427,Also checkout servers show CPU and memory limits exceeded alerts this definitely looks bigger than just an app issue
18,23/10/2025 10:14,Daniel,online-boutique-6427,```app[checkout-service]: systemd[1]
19,23/10/2025 10:14,Shay,online-boutique-6427,Could this be due to load or any changes ?
20,23/10/2025 10:15,player10,online-boutique-6427,May be issue with infra
21,23/10/2025 10:15,Shay,online-boutique-6427,Here's the wiki of all changes made today\n<https://uptime-labs.atlassian.net/wiki/external/YzYwYTAxNWQzOTI0NDYzOWI1MjkxNTI2YmVmMjUyZDE>
22,23/10/2025 10:15,player10,online-boutique-6427,Tanya Can you check please what could be the cause of these alerts/logs?
23,23/10/2025 10:15,Tanya,online-boutique-6427,Sure
24,23/10/2025 10:16,player10,online-boutique-6427,Shay when did you start getting alerts?
25,23/10/2025 10:16,player10,online-boutique-6427,what time?
26,23/10/2025 10:16,Shay,online-boutique-6427,I saw the first alerts 30 minutes ago
27,23/10/2025 10:16,Daniel,online-boutique-6427,Let’s check if this is affecting users directly maybe Bob from Support has more context?
28,23/10/2025 10:17,player10,business-comms-6427,Hi Bez what are customers complaining aboit?
29,23/10/2025 10:17,player10,business-comms-6427,about?
30,23/10/2025 10:17,player10,business-comms-6427,are they not able to place orders?
31,23/10/2025 10:17,Bez,business-comms-6427,Bob would have more information on this
32,23/10/2025 10:17,player10,online-boutique-6427,Bob is it effecting all customers?
33,23/10/2025 10:17,Bob,online-boutique-6427,Sure let me look at my reports
34,23/10/2025 10:18,Bob,online-boutique-6427,Here are some of the complaints we've received in the last few minutes. It's coming all across the globe
35,23/10/2025 10:18,player10,business-comms-6427,Asking
36,23/10/2025 10:18,Bob,online-boutique-6427,"Germany - ""I added items to my cart clicked checkout and it just kept spinning. Then it dumped me back to an empty cart"
37,23/10/2025 10:18,Bob,online-boutique-6427,"USA - ""Order failed twice and now the cart is empty. I refreshed but now the site is laggy"
38,23/10/2025 10:18,Bob,online-boutique-6427,"Japan - ""Got to checkout then error 502. Tried again - cart gone"
39,23/10/2025 10:18,Bob,online-boutique-6427,To sum it all we have got 240+ reports globally
40,23/10/2025 10:18,Bob,online-boutique-6427,Metrics
41,23/10/2025 10:18,Tanya,online-boutique-6427,Checking infra...
42,23/10/2025 10:18,player10,online-boutique-6427,okay let me raise Sev 1 incident
43,23/10/2025 10:19,Tanya,online-boutique-6427,All four checkout servers are maxed out - CPU memory and disk I/O all spiking. No changes or deployments were done from platform side
44,23/10/2025 10:19,Tanya,online-boutique-6427,ServerMetrics
45,23/10/2025 10:19,player10,online-boutique-6427,\\incident Sev1 : SOme customers not able to complete order
46,23/10/2025 10:19,Tanya,online-boutique-6427,It doesn't looks like a load issue either. CPU and Memory spike is not matching with incoming traffic
47,23/10/2025 10:19,Tanya,online-boutique-6427,I'm seeing a running process called init_locker.sh eating up most of the CPU on the checkout server. That's not something we usually run. Something's suspicious here
48,23/10/2025 10:19,Tanya,online-boutique-6427,ProcessRunning
49,23/10/2025 10:19,player10,online-boutique-6427,: Sev1 : SOme customers not able to complete order
50,23/10/2025 10:19,player10,business-comms-6427,*Incident Number INC100053:* : Sev1 : SOme customers not able to complete order
53,23/10/2025 10:19,Bez,business-comms-6427,I'm seeing some posts on social media about issues with our platform is this a regional issue or hitting customers globally?
54,23/10/2025 10:20,player10,online-boutique-6427,Tanya Can you check what time init_locker.sh started ?
55,23/10/2025 10:20,Tanya,online-boutique-6427,On it
56,23/10/2025 10:21,player10,business-comms-6427,We are actively investigating the issue
57,23/10/2025 10:21,Tanya,online-boutique-6427,About 45 minutes ago
58,23/10/2025 10:21,Tanya,online-boutique-6427,I haven't seen this script before
59,23/10/2025 10:22,Shay,online-boutique-6427,Do we suspect this issue to be change related?
60,23/10/2025 10:22,player10,online-boutique-6427,Daniel you deployed *Change Request: CHG919048 40 mins ago is it related to this change?* init_locker.sh?
61,23/10/2025 10:23,Daniel,online-boutique-6427,No but if you would like me and shay can review all changes to rule them out
62,23/10/2025 10:23,player10,online-boutique-6427,Yes pls do
63,23/10/2025 10:23,Shay,online-boutique-6427,Ok reviewing the change
64,23/10/2025 10:23,player10,online-boutique-6427,Also check *Change Request: CHG919047*
65,23/10/2025 10:24,Daniel,online-boutique-6427,:thumbsup:
66,23/10/2025 10:24,Daniel,online-boutique-6427,I don't think this is due to any changes because nothing matches the issue start time and no PROD deployments have happened in a while around checkout service
67,23/10/2025 10:24,Tanya,online-boutique-6427,Same from the platform side. Strangely both apps and infrastructure are struggling without any changes
68,23/10/2025 10:24,Shay,online-boutique-6427,You're right that makes sense. On top of that only checkout is having issues and it hasn't been touched in a while
69,23/10/2025 10:25,player10,online-boutique-6427,Tanya can you check anything more on what change has deployed init_locker.sh? Also can you check for any other red flag on resourse usage?
70,23/10/2025 10:25,Tanya,online-boutique-6427,I will but these symptoms are very unusual. We should think of getting SecOps here now
71,23/10/2025 10:26,player10,online-boutique-6427,SecOps? Who is in that team let me ask Hamed
72,23/10/2025 10:26,Tanya,online-boutique-6427,@maya
73,23/10/2025 10:26,player10,online-boutique-6427,Maya Can you please look into heavy resource usage
74,23/10/2025 10:27,Maya,online-boutique-6427,Hey team
75,23/10/2025 10:27,Maya,online-boutique-6427,Let me check if there's anything suspicious
76,23/10/2025 10:27,player10,online-boutique-6427,Tanya can you please explain to Maya?
77,23/10/2025 10:27,Tanya,online-boutique-6427,Sure
78,23/10/2025 10:27,Bez,business-comms-6427,"Got an email claiming responsibility by ""BlackCrow Group"" and demanding payment of $5M in crypto. Honestly I get these hoax emails all the time so I'm not buying it"
79,23/10/2025 10:27,Maya,online-boutique-6427,Weird!! Security agent known as EDR(Endpoint Detection and Response) is missing from all 4 checkout servers. That's? concerning
80,23/10/2025 10:27,Maya,online-boutique-6427,```EDR is basically our endpoint defense tool it tracks unusual activity at the servers```
81,23/10/2025 10:27,Maya,online-boutique-6427,AlsoI found an init_locker.sh script encrypting DB app and log files which is renaming the filename like below
82,23/10/2025 10:27,Maya,online-boutique-6427,```\norder_log_2025-06-01.locked\nsession_state.tmp.locked```
83,23/10/2025 10:27,Daniel,online-boutique-6427,this explains why there were errors in checkout logs saying write failed  read-only filesystem
84,23/10/2025 10:27,Tanya,online-boutique-6427,Wait... there's a file here named HELP_ME_DECRYPT.txt. I opened it appears a ransom note. This doesn't look good
85,23/10/2025 10:27,Tanya,online-boutique-6427,help_me_decrypt
86,23/10/2025 10:27,Maya,online-boutique-6427,Confirmed. This is a ransomware breach. @player10 inform business about this
87,23/10/2025 10:28,Tanya,online-boutique-6427,Shall i try killing this script ?
88,23/10/2025 10:28,Bob,online-boutique-6427,Guys!!! User complaints are sky rocketing its turning catastrophic!
89,23/10/2025 10:28,player10,business-comms-6427,We are looking into secOps for any anything suspecious
90,23/10/2025 10:28,Bez,business-comms-6427,Wait! you're telling me this is an actual ransomware hit?
91,23/10/2025 10:28,Bez,business-comms-6427,Alright tell everyone no one says a single thing outside online-boutique! I don't care who's asking not a word until we know exactly what's going on!
92,23/10/2025 10:29,player10,business-comms-6427,Looks like it is his is a ransomware breach.
93,23/10/2025 10:29,player10,online-boutique-6427,Maya How can we fic it?
94,23/10/2025 10:29,player10,online-boutique-6427,Fix
95,23/10/2025 10:29,Maya,online-boutique-6427,Killing the script could make things worse higher ransom or losing data forever
96,23/10/2025 10:29,Bez,business-comms-6427,This is nightmare! @player10 where are we right now?
97,23/10/2025 10:29,Maya,online-boutique-6427,@player10 before we do anything I'd request everyone to please change their passwords
98,23/10/2025 10:30,Maya,online-boutique-6427,Also I'm removing everyone's access to servers - only I'll have control for now. Later we will reassess to do any activity further
99,23/10/2025 10:30,Daniel,online-boutique-6427,Done on my end
100,23/10/2025 10:30,Hamed,online-boutique-6427,Updated. @Maya smart move by limiting server's access
101,23/10/2025 10:30,player10,business-comms-6427,Working with Maya on it
102,23/10/2025 10:30,Shay,online-boutique-6427,Password updated
103,23/10/2025 10:30,Bob,online-boutique-6427,Changed mine too. Better safe than sorry
104,23/10/2025 10:30,Tanya,online-boutique-6427,All set
105,23/10/2025 10:30,Tanya,online-boutique-6427,It's much worse now. Every file I check is encrypted nothing can be opened or recovered.
106,23/10/2025 10:30,Shay,online-boutique-6427,I'm seeing new errors on frontend now. How's it for you @player10 ?
107,23/10/2025 10:30,Maya,online-boutique-6427,Attention! when it comes to potential security breaches it's important we don't discuss sensitive details here
108,23/10/2025 10:30,Maya,online-boutique-6427,I'm setting up private channel...
109,23/10/2025 10:30,Maya,online-boutique-6427,@player10 before we move to private channel can you check with business what's the plan - are we paying the ransom or moving with response?
110,23/10/2025 10:31,player10,online-boutique-6427,I don't think we should pay bit let me chack
111,23/10/2025 10:31,Maya,online-boutique-6427,Agree
112,23/10/2025 10:32,player10,business-comms-6427,Bez just confirming with you we don't want to pay rensom? Instead try to fix ourselves?
113,23/10/2025 10:32,Bez,business-comms-6427,Not in favor of paying. Ethically it sets the wrong example and there's no real guarantee we'll get anything back
114,23/10/2025 10:32,Tinus,business-comms-6427,Agree. Also just to be clear - we don't need to alert the ICO(Information Commissioner's Office) right this second. We've got up to 72 hours but that depends on how serious this really is
115,23/10/2025 10:32,Maya,private-comms-6427,@player10 let's build the core response team here. I've already added myself. Who else should we pull in to keep it tight and efficient?
116,23/10/2025 10:32,Maya,private-comms-6427,I'd say one senior person each from security platform and engineering. Also add Tanya tasks could be platform intensive
117,23/10/2025 10:32,Bez,business-comms-6427,@Tinus do you think this is something we should loop in any cyber security agency for?
118,23/10/2025 10:32,Tinus,business-comms-6427,If it looks like a complete lock-out I'd say yes
119,23/10/2025 10:32,Tinus,business-comms-6427,We've got Cyvantics Security on retainer - just in case this gets out of hand. @player10 ask Maya to reach out if needed
120,23/10/2025 10:33,player10,private-comms-6427,Yes pls add Tanya and Danial
121,23/10/2025 10:33,Maya,private-comms-6427,@tanya @daniel and @hamed
122,23/10/2025 10:33,Maya,private-comms-6427,Done
123,23/10/2025 10:33,player10,private-comms-6427,and Tinus
124,23/10/2025 10:33,Maya,private-comms-6427,@tinus
125,23/10/2025 10:34,player10,business-comms-6427,We are adding you to core response team Tinus
126,23/10/2025 10:34,Tinus,private-comms-6427,I'm here if you have any questions but reach out in business comms to have board and bez updated
127,23/10/2025 10:34,player10,private-comms-6427,and Hamed as well pls
128,23/10/2025 10:34,Maya,private-comms-6427,:thumbsup:
129,23/10/2025 10:35,player10,private-comms-6427,Maya please suggest how we can fix the issue?
130,23/10/2025 10:35,Hamed,private-comms-6427,Things are going out of hands. @Maya do we have any external support for these situations ?
131,23/10/2025 10:35,Maya,private-comms-6427,Yes we've got an IR(incident response) retainer with Cyvantics Security
132,23/10/2025 10:35,Bez,business-comms-6427,@player10 I need a clear answer from the team. What exactly is affected right now?
133,23/10/2025 10:35,Maya,private-comms-6427,Looped in Cyvantics Security - they're on their way now to take snapshots of the infected server and storage followed by forensics on it
134,23/10/2025 10:35,Tinus,business-comms-6427,You're right. We need clear facts - which systems are locked which are safe
135,23/10/2025 10:35,Maya,private-comms-6427,Meanwhile I've got this from Cyvantics. @player10 can you help track the steps and coordinate?
136,23/10/2025 10:35,player10,business-comms-6427,We know the cause working on solution now. I will keep you updated
137,23/10/2025 10:35,Maya,private-comms-6427,<https://uptime-labs.atlassian.net/wiki/external/MThjMTk4ZDU5ODU0NGZmMWE1NzhmNGY0MDQwNWI1NTA>
138,23/10/2025 10:35,Maya,private-comms-6427,We've got isolation steps in the playbook but before we dive in can you paste that list here? I'll help team run through it
139,23/10/2025 10:36,player10,private-comms-6427,Steps for Isolation:\n\n\nSteps to be done mentioned along with the *owning* team\n1. Disconnect the infected server -> Platforms \n2. Cut off infrastructure traffic -> Platforms\n3. Disconnect DB & freeze backup -> Application\n4. Detach from Shared Resource -> Platforms\n5. Take snapshots (Disk & Memory) -> Ask team\n6. Kill suspicious process or activity -> Platforms
140,23/10/2025 10:37,Maya,private-comms-6427,Great
141,23/10/2025 10:37,Maya,private-comms-6427,I've given write access to Tanya Hamed Daniel and myself
142,23/10/2025 10:37,Bob,online-boutique-6427,@player10 user complaints are spiking. They're reporting the site is down earlier it wasn't the case. What should I tell them now?
143,23/10/2025 10:37,Tanya,private-comms-6427,Disconnecting the checkout servers from the infra now
144,23/10/2025 10:37,Daniel,private-comms-6427,I'm on it. Disconnecting DB access for checkout and checking if scheduled backups exist
145,23/10/2025 10:37,Hamed,private-comms-6427,I'll verify if any shared storage is still attached to the checkout DB
146,23/10/2025 10:37,Daniel,private-comms-6427,Step 3 done DB connection to checkout is now cut
147,23/10/2025 10:37,Tanya,private-comms-6427,Step 1 done Checkout servers are now fully disconnected. Moving to isolate the infra from all external traffic
148,23/10/2025 10:37,Hamed,private-comms-6427,Step 4 confirmed No shared storage attached to checkout which makes sense since checkout has its standalone storage
149,23/10/2025 10:37,player10,private-comms-6427,Step 2?
150,23/10/2025 10:37,Tanya,private-comms-6427,Step 2 completed Infra is now fully cut off from the outside world. That means the website will remain completely down until we recover
151,23/10/2025 10:37,Maya,private-comms-6427,Step 5 done Cyvantics has completed taking snapshots of the checkout servers and database. They've now moved on to forensics. @Hamed we're good to kill the script now
152,23/10/2025 10:37,Bez,business-comms-6427,Do we have any backup storage? Maybe we can try restoring from that
153,23/10/2025 10:37,player10,private-comms-6427,Step 6?
154,23/10/2025 10:37,Hamed,private-comms-6427,Step 6 done The Script has been killed. @player10 let us know and double-check if anything else is pending on our side
155,23/10/2025 10:38,player10,private-comms-6427,Good all steps done
156,23/10/2025 10:38,player10,private-comms-6427,Steps for Restoration:\n\n\nSteps to be done mentioned along with the *owning* team\n1. Validate backups → Security\n2. Wipe infected systems → Platforms\n3. Rebuild from clean backup → Platforms\n4. Re-enable security agent on the servers → Security\n5. Reconnect traffic to services and monitor → Platforms
157,23/10/2025 10:38,Daniel,private-comms-6427,Now we need to work on restoration do we have a backup?
158,23/10/2025 10:39,Maya,private-comms-6427,Yes we must have a backup. Platform team can confirm us
159,23/10/2025 10:39,player10,private-comms-6427,Step 1 in progress
160,23/10/2025 10:39,Hamed,private-comms-6427,Correct we do have backup which only runs at 2AM. Latest is yesterday's. We'll lose today's orders
161,23/10/2025 10:39,Maya,private-comms-6427,Isolation is complete. We're good to move toward restoration using the backup storage now
162,23/10/2025 10:39,Maya,private-comms-6427,@player10 could you please confirm with business before moving forward on this
163,23/10/2025 10:39,Maya,private-comms-6427,I've called in @Bob to the channel
164,23/10/2025 10:39,Bob,private-comms-6427,@player10 I hear you need my help what exactly should I look into?
165,23/10/2025 10:39,player10,business-comms-6427,Isolation is complete we are moving to resolution now
166,23/10/2025 10:39,Bob,private-comms-6427,With the sale starting today the potential loss is significant - around $180k
167,23/10/2025 10:40,player10,business-comms-6427,Yes we have back up
168,23/10/2025 10:40,player10,online-boutique-6427,We are working on the resolution
169,23/10/2025 10:41,player10,business-comms-6427,Can we proceed with resolution?
170,23/10/2025 10:41,Bez,business-comms-6427,Is there any impact on restoration from backup?
171,23/10/2025 10:41,Maya,private-comms-6427,Are we good with business on this loss of $180k worth of orders ?
172,23/10/2025 10:41,player10,private-comms-6427,We want to confirm we we proceed to resolution from backup?
173,23/10/2025 10:41,player10,private-comms-6427,Bob
174,23/10/2025 10:42,Bob,private-comms-6427,Correct
175,23/10/2025 10:42,player10,business-comms-6427,Yes Are we good with business on this loss of $180k worth of orders
176,23/10/2025 10:42,Bez,business-comms-6427,Losing this much worth of data isn't good. However we do have insurance let me check
177,23/10/2025 10:42,Bez,business-comms-6427,We're insured for up to $1M for such losses. Once we're back up we'll take it forward with the insurer
178,23/10/2025 10:42,player10,private-comms-6427,I am asking Bez he will confimr
179,23/10/2025 10:42,Tinus,business-comms-6427,In that case we can proceed with the restoration from backup - it's our best option right now
180,23/10/2025 10:42,Bez,business-comms-6427,Agreed. @player10 let's move forward
181,23/10/2025 10:43,Bez,business-comms-6427,Update me as soon as it'll be recovered. Board members are getting impatient
182,23/10/2025 10:43,player10,private-comms-6427,Bez is good for us to go ahead
183,23/10/2025 10:43,Maya,private-comms-6427,Thanks for the go-ahead. @player10 please track all restoration steps
184,23/10/2025 10:43,player10,private-comms-6427,Maya plese proceed
185,23/10/2025 10:43,Maya,private-comms-6427,I'm now validating the backup storage to ensure it's safe
186,23/10/2025 10:43,Hamed,private-comms-6427,I'm provisioning new checkout servers will update once ready
187,23/10/2025 10:43,player10,private-comms-6427,Steps for Restoration:\n\n\nSteps to be done mentioned along with the *owning* team\n1. Validate backups → Security\n2. Wipe infected systems → Platforms\n3. Rebuild from clean backup → Platforms\n4. Re-enable security agent on the servers → Security\n5. Reconnect traffic to services and monitor → Platforms
188,23/10/2025 10:43,Maya,private-comms-6427,Backup is clean and safe. @Hamed you can start rebuilding checkout from backup storage
189,23/10/2025 10:43,Hamed,private-comms-6427,Thanks Maya. New servers are ready. I'll start rebuilding now using backup storage
190,23/10/2025 10:44,Hamed,private-comms-6427,Rebuild completed
191,23/10/2025 10:44,Maya,private-comms-6427,I've enabled the security agents (EDR) on checkout servers
192,23/10/2025 10:44,player10,business-comms-6427,We are sarting now
193,23/10/2025 10:44,Daniel,private-comms-6427,I'll monitor application health once services are restored
194,23/10/2025 10:44,Maya,private-comms-6427,@player10  can you confirm all tasks are wrapped up and we are good to bring the traffic back? Just want to be sure as this is the final restoration step before we move
195,23/10/2025 10:44,player10,private-comms-6427,Re-enable security agent on the servers?
196,23/10/2025 10:45,Maya,private-comms-6427,I have done it  indeed
197,23/10/2025 10:45,player10,private-comms-6427,Is Wipe infected systems done?
198,23/10/2025 10:45,Hamed,private-comms-6427,I can confirm done my part
199,23/10/2025 10:46,player10,private-comms-6427,Yes 1 to 4 complete
200,23/10/2025 10:46,player10,private-comms-6427,Please proceed to step 5
201,23/10/2025 10:46,Maya,private-comms-6427,Great!  Go ahead @tanya
202,23/10/2025 10:46,player10,private-comms-6427,1. Reconnect traffic to services and monitor → Platforms
203,23/10/2025 10:46,Tanya,private-comms-6427,Thanks for the go ahead. Bringing up network traffic in progress...
204,23/10/2025 10:47,Tanya,private-comms-6427,Restoration completed
205,23/10/2025 10:47,player10,private-comms-6427,Can you check if site is back up?
206,23/10/2025 10:47,Bob,private-comms-6427,Wait!! getting a bunch of new complaints now. Users are neither able to see their return requests nor able to place new returns on the site
207,23/10/2025 10:47,player10,private-comms-6427,Bob can you also check pls?
208,23/10/2025 10:47,Maya,private-comms-6427,Yeah that's probably the missing today's checkout data. Anyone who ordered or returned something during that time won't see it - makes sense since we restored from the yesterday's backup
210,23/10/2025 10:47,Tanya,private-comms-6427,Tough but expected :)
211,23/10/2025 10:47,Bob,private-comms-6427,What should I tell them? They are asking for refunds
212,23/10/2025 10:47,Daniel,private-comms-6427,Checking now!
213,23/10/2025 10:48,Daniel,private-comms-6427,I was able to place an order
214,23/10/2025 10:48,Bob,private-comms-6427,What's the business stance on this?
215,23/10/2025 10:48,player10,business-comms-6427,Bez Anyone who ordered or returned something during that time won't see it - makes sense since we restored from the yesterday's backup
216,23/10/2025 10:48,player10,business-comms-6427,They are asking for refund
217,23/10/2025 10:48,Bez,business-comms-6427,Keeping it high-level just say website restored but there's an issue with few orders. We'll refund them and customers will get a $10 gift voucher as an apology
218,23/10/2025 10:49,player10,business-comms-6427,WHat do you suggest?
219,23/10/2025 10:49,Maya,private-comms-6427,@player10 I've received the forensics report from Cyvantics Security
220,23/10/2025 10:49,Maya,private-comms-6427,forensics
221,23/10/2025 10:49,Maya,private-comms-6427,Also I just finished combing through Shay's mailbox. There's something important here I found two emails from what looks like our monitoring vendor - ClearTech
222,23/10/2025 10:49,Maya,private-comms-6427,phished_email
223,23/10/2025 10:49,player10,business-comms-6427,Bob pls follow Bez's advice
224,23/10/2025 10:49,Maya,private-comms-6427,We will take this forward in PIR  for now website is restored
225,23/10/2025 10:50,Maya,private-comms-6427,Alright since everything's back up and stable we can now move back to the main #online-boutique channel. No further actions left here
