datetime,player,channel,message
2025-11-28 15:54:33,Bez,business-comms-6963,"Keeping it high-level, just say website restored, but there's an issue with few orders. We'll refund them, and customers will get a $10 gift voucher as an apology"
2025-11-28 15:54:34,Tanya,private-comms-6963,"Tough, but expected :)"
2025-11-28 15:54:35,Bob,private-comms-6963,What should I tell them? They are asking for refunds
2025-11-28 15:54:47,Maya,private-comms-6963,@julian.wreford I've received the forensics report from Cyvantics Security
2025-11-28 15:54:50,Maya,private-comms-6963,forensics
2025-11-28 15:54:50,PLAYER,private-comms-6963,Hamed S are there any other methods of data restoration? Could we get user emails from the logs to figure out who has a missing order?
2025-11-28 15:55:03,Maya,private-comms-6963,Can you see the website is back again ? @julian.wreford
2025-11-28 15:55:07,Maya,private-comms-6963,"Also, I just finished combing through Shay's mailbox. There's something important here, I found two emails from what looks like our monitoring vendor - ClearTech"
2025-11-28 15:55:07,PLAYER,private-comms-6963,"Bob Keeping it high-level, just say website restored, but there's an issue with few orders. We'll refund them, and customers will get a $10 gift voucher as an apology"
2025-11-28 15:55:09,Maya,private-comms-6963,phished_email
2025-11-28 15:55:27,Maya,private-comms-6963,"We will take this forward in PIR , for now website is restored"
2025-11-28 15:55:30,Hamed,private-comms-6963,Data can be restored but it will take days to clean them up and reinstate them again. We will work on this later
2025-11-28 15:55:37,Maya,private-comms-6963,"Alright, since everything's back up and stable, we can now move back to the main #online-boutique channel. No further actions left here"
2025-11-28 15:55:37,PLAYER,online-boutique-6963,"Bob Keeping it high-level, just say website restored, but there's an issue with few orders. We'll refund them, and customers will get a $10 gift voucher as an apology"
2025-11-28 15:55:46,Bob,private-comms-6963,Thanks @julian.wreford
2025-11-28 15:55:47,Maya,online-boutique-6963,Do we go ahead and mark this incident as closed?
2025-11-28 15:56:05,PLAYER,online-boutique-6963,"Not yet, I'd like to see if we can do anything for the customers who's orders we lost"
2025-11-28 15:56:11,Bob,online-boutique-6963,I've told my team to communicate the same to customers
2025-11-28 15:56:41,PLAYER,online-boutique-6963,Hamed S you said that there was a method of data restoration but it would take days. Why is that?
2025-11-28 15:57:07,Hamed,online-boutique-6963,Because its an infected data
2025-11-28 15:57:30,Hamed,online-boutique-6963,Its recoverable. But decrypting them all will take longer
2025-11-28 15:57:51,Hamed,online-boutique-6963,I can see that all the servers are running in a healthy state now
2025-11-28 15:58:03,PLAYER,online-boutique-6963,Bob we should update the status page to say that things are in working order but that orders made today have been lost. Refer them back to the gift cards
2025-11-28 15:58:14,Maya,online-boutique-6963,Nothing concerning so far in my dashboard
2025-11-28 15:58:24,Bob,online-boutique-6963,"Sure @julian.wreford, i'll do it"
2025-11-28 15:58:35,PLAYER,online-boutique-6963,Incident resolved
2025-11-28 15:58:41,Bez,business-comms-6963,"Since services are restored, I'm heading to speak with compliance and the regulators. Thankfully, no data was leaked, that helps"
2025-11-28 15:58:42,Tanya,online-boutique-6963,That was intense. We've never been this close to total loss before. We got lucky
2025-11-28 15:58:44,Tinus,business-comms-6963,I'm on my way to the ICO (Information Commissioner's Office - UK) office now. I'll get the formal report rolling - that's required for the insurance claim. Keep monitoring in the meantime
2025-11-28 15:58:45,Daniel,online-boutique-6963,"Systems are calm now, but that feeling earlier... not something I want to go through again"
2025-11-28 15:58:48,Bob,online-boutique-6963,One small slip caused a major breach. We need better awareness to prevent this in future
2025-11-28 15:58:50,Tinus,online-boutique-6963,This could've gone way worse. Appreciate how quickly and cleanly you handled it
2025-11-28 15:58:54,Bez,online-boutique-6963,"Not every day we survive an attack like this. You made the right calls, fast. Great job, @julian.wreford - that's how we bounce back"
2025-11-28 15:59:01,UptimeLabs,online-boutique-6963,"Thank you for playing, We recommend that you take 5 minutes to go and get a drink or stretch your legs.
Once you are back we ask that you complete this retrospective and feedback form, just hit I am ready when you want to start. I am ready button"
2025-11-28 16:09:06,PLAYER,online-boutique-6963,Clicked Start_feedback button
