datetime,player,channel,message
2026-03-03 11:35:06,PLAYER,private-comms-7868,"ok let's follow the steps:

ISOLATION:

Disconnect infected server – Immediately block all traffic to and from the compromised server. Isolate it from the network and any shared systems to stop the ransomware from spreading further. This is your first and fastest containment move.

Cut off infrastructure traffic – Halt all inbound and outbound network access across the infrastructure if needed. This creates a hard boundary for the attack, buying time to investigate. It may temporarily impact services, but it’s safer than letting the malware move.

Disconnect DB & freeze backup – Stop all application-level connections to the database. Pause or disable automated backup jobs to prevent infected or encrypted data from overwriting clean backups. Protecting clean copies is critical for recovery.

Detach from shared resources – If the infected server is connected to shared storage, NAS(Network attached storage), or databases, detach it immediately. Ransomware often tries to encrypt anything it can access, so this step prevents collateral damage.

Take snapshot (disk & memory) – Before making any changes, capture a complete disk image and memory snapshot. This is essential for forensic investigation, legal purposes, and possible decryption. Once altered, evidence can’t be recovered.

Kill suspicious processes – After you’ve taken snapshots, terminate the ransomware or malicious processes. This stops further encryption or damage, but killing processes too early can trigger irreversible encryption — timing matters."
2026-03-03 11:35:08,daniel,private-comms-7868,"Step 3 done, DB connection to checkout is now cut"
2026-03-03 11:35:10,tanya,private-comms-7868,"Step 1 done, Checkout servers are now fully disconnected. Moving to isolate the infra from all external traffic"
2026-03-03 11:35:12,hamed,private-comms-7868,"Step 4 confirmed, No shared storage attached to checkout, which makes sense since checkout has its standalone storage"
2026-03-03 11:35:15,PLAYER,private-comms-7868,hold on
2026-03-03 11:35:18,tanya,private-comms-7868,"Step 2 completed, Infra is now fully cut off from the outside world. That means the website will remain completely down until we recover"
2026-03-03 11:35:23,maya,private-comms-7868,"Step 5 done, Cyvantics has completed taking snapshots of the checkout servers and database. They've now moved on to forensics. @Hamed, we're good to kill the script now"
2026-03-03 11:35:26,bez,business-comms-7868,Do we have any backup storage? Maybe we can try restoring from that
2026-03-03 11:35:30,PLAYER,private-comms-7868,do the steps need to be done in sequence or in any order?
2026-03-03 11:35:33,hamed,private-comms-7868,"Step 6 done, The Script has been killed. @stuck2-bloomberg.net let us know and double-check if anything else is pending on our side"
2026-03-03 11:35:47,maya,private-comms-7868,Isolation can be done in any order. restoration has to be in sequence
2026-03-03 11:35:53,PLAYER,private-comms-7868,let's make sure we know who is running each step
2026-03-03 11:35:55,uptimelabs,online-boutique-7868,:star: Know your team and their roles
2026-03-03 11:36:11,PLAYER,private-comms-7868,step 6 is meant to be sequenced after 5
2026-03-03 11:36:15,PLAYER,private-comms-7868,which it was
2026-03-03 11:36:19,PLAYER,private-comms-7868,but let's not rush this
2026-03-03 11:36:19,PLAYER,business-comms-7868,We are in the process of isolating the infected servers and getting them cleaned up 
2026-03-03 11:36:35,PLAYER,private-comms-7868,are we all clear that isolation is complete?
2026-03-03 11:36:38,uptimelabs,online-boutique-7868,:star: Ask team members to provide evidence of their assertions
2026-03-03 11:36:44,maya,private-comms-7868,Isolation has been done
2026-03-03 11:36:47,PLAYER,private-comms-7868,I see that all steps 1-6 are done
2026-03-03 11:36:50,uptimelabs,online-boutique-7868,:star: Use metrics as evidence
2026-03-03 11:36:53,PLAYER,private-comms-7868,ok moving to restoration
2026-03-03 11:36:53,hamed,private-comms-7868,"For the restoration, we do have backup which only runs at 2AM. Latest is yesterday's. Unfortunately, we'll lose today's orders"
2026-03-03 11:36:59,maya,private-comms-7868,I've got Bob in the discussion so he can confirm the approximate loss in order value
2026-03-03 11:37:19,PLAYER,business-comms-7868,"Infected servers/infra has been isolated, we are working on the restoration now"
2026-03-03 11:37:19,bob,private-comms-7868,"With the sale starting today, the potential loss is significant, approx. around $180k"
2026-03-03 11:37:23,maya,private-comms-7868,@stuck2-bloomberg.net could you please confirm this order loss with business before moving forward on this 
2026-03-03 11:37:50,PLAYER,online-boutique-7868,@bob this is expected as of now. we are isolating the servers that are infected
2026-03-03 11:38:14,PLAYER,private-comms-7868,what is the alternative?
2026-03-03 11:38:17,PLAYER,online-boutique-7868,we are in the process of restoration and will let you know when it is good to test for the fix
2026-03-03 11:38:31,maya,private-comms-7868,We can try to recover the locked data but its highly uncertain on how much time it will take to recover that data
2026-03-03 11:38:37,PLAYER,private-comms-7868,do we have a way to back up today's orders
2026-03-03 11:38:40,bez,business-comms-7868,okay-
2026-03-03 11:38:51,PLAYER,private-comms-7868,can we store the locked data
2026-03-03 11:38:57,PLAYER,private-comms-7868,and how long would that take?
2026-03-03 11:38:58,bez,business-comms-7868,Which Apps are affected did you say @John ?
2026-03-03 11:39:02,hamed,private-comms-7868,I dont this so we have any other backup for current orders
2026-03-03 11:39:16,maya,private-comms-7868,May take more than a day to recover
2026-03-03 11:39:21,PLAYER,private-comms-7868,can you repeat please @hamed 
2026-03-03 11:39:27,maya,private-comms-7868,Right now using the 2AM backup is the best choice
2026-03-03 11:39:35,PLAYER,business-comms-7868,its the checkout service on the online boutique that is affected here 
2026-03-03 11:39:45,PLAYER,private-comms-7868,was that I don't think @hamed?
2026-03-03 11:39:55,hamed,private-comms-7868,This is the best option we have got to restore the systems
2026-03-03 11:40:04,PLAYER,business-comms-7868,"we have encountered a difficulty with the restoration, we do not have a backup of the sales today. ENG team are working to identify a workaround for it now"
2026-03-03 11:40:05,PLAYER,private-comms-7868,"@maya not talking about recovery, talking about taking a snapshot"
2026-03-03 11:40:07,uptimelabs,online-boutique-7868,:star: Formally assign criticality level to the incident
2026-03-03 11:40:10,PLAYER,private-comms-7868,how long would that be?
2026-03-03 11:40:15,hamed,private-comms-7868,"Later on, Maya and Cyvantics could work together to get the lost data back"
2026-03-03 11:40:29,PLAYER,private-comms-7868,ok
2026-03-03 11:40:35,PLAYER,business-comms-7868,"With the isolation now, uses will not be able to access the website and wil get a '502 Bad Gateway' error"
2026-03-03 11:40:45,PLAYER,private-comms-7868,"let's move to restoration then, and let's wait for confirmation before proceeding with each step"
2026-03-03 11:40:57,maya,private-comms-7868,Sure
2026-03-03 11:40:59,PLAYER,private-comms-7868,"RESTORATION:  

1. Validate backups – Check all saved copies of your data to make sure they’re not infected by the attack. Only use backups from before the attack started.

"
2026-03-03 11:41:09,maya,private-comms-7868,I''m now validating the backup storage to ensure it''s safe
2026-03-03 11:41:16,PLAYER,private-comms-7868,2am is before 10am when sale kicked off
2026-03-03 11:41:26,PLAYER,private-comms-7868,please doublecheck
2026-03-03 11:41:48,maya,private-comms-7868,Backup is clean and safe.
2026-03-03 11:42:03,bob,private-comms-7868,Sale started today at 10 AM
2026-03-03 11:42:15,PLAYER,private-comms-7868,thanks
2026-03-03 11:42:21,PLAYER,online-boutique-7868,Escalating the priority /incident website is down
2026-03-03 11:42:31,PLAYER,private-comms-7868,2. Wipe infected systems – Completely erase (format) any computers or servers that were hit by the attack so no harmful files remain.
2026-03-03 11:42:40,hamed,private-comms-7868,On it now
2026-03-03 11:42:42,PLAYER,private-comms-7868,who can take this on
2026-03-03 11:42:47,PLAYER,private-comms-7868,thanks @hamed
2026-03-03 11:42:58,hamed,private-comms-7868,Ok i've wiped off the infrected system
2026-03-03 11:43:00,PLAYER,business-comms-7868,Work in progress on the restoration now
2026-03-03 11:43:07,PLAYER,private-comms-7868,can we please post who can take each step and want for my go ahead
2026-03-03 11:43:11,uptimelabs,online-boutique-7868,:star: Form an effective investigation team
2026-03-03 11:43:11,uptimelabs,online-boutique-7868,:star: Track actions and time box them
2026-03-03 11:43:18,bez,business-comms-7868,Lets do what needs to be done for restoration
2026-03-03 11:43:21,tanya,private-comms-7868,I'll rebuild the servers
2026-03-03 11:43:25,bez,business-comms-7868,Thanks
2026-03-03 11:43:30,PLAYER,private-comms-7868,Rebuild from clean backup – Use the safe backup you found earlier to put the system back the way it was before the attack.
2026-03-03 11:43:36,PLAYER,private-comms-7868,ok @tanya go ahead please
2026-03-03 11:43:40,tanya,private-comms-7868,I''ll start rebuilding now using backup storage
2026-03-03 11:43:58,tanya,private-comms-7868,Rebuild completed
2026-03-03 11:44:11,PLAYER,private-comms-7868,"Re-enable security tools on servers – Before putting the systems back on the network, reinstall antivirus, firewalls, and other security software so they’re protected."
2026-03-03 11:44:17,PLAYER,business-comms-7868,"work is in progress, will update once completed"
2026-03-03 11:44:20,maya,private-comms-7868,I'm doing it
2026-03-03 11:44:20,PLAYER,private-comms-7868,@maya can you take this one?
2026-03-03 11:44:36,PLAYER,private-comms-7868,please do not action before I give go ahead
2026-03-03 11:44:41,PLAYER,private-comms-7868,@maya please go ahead
2026-03-03 11:44:50,maya,private-comms-7868,I''ve enabled the security agents (EDR) on checkout servers
2026-03-03 11:45:07,tanya,private-comms-7868,I can bring up traffic once you give me the go ahead
2026-03-03 11:45:25,PLAYER,private-comms-7868,"now before we reconnect, we don't know how they got in so we have to be monitoring for anything unusual"
2026-03-03 11:45:37,daniel,private-comms-7868,I will monitor logs
2026-03-03 11:45:45,hamed,private-comms-7868,I'm keeping an eye on infra
2026-03-03 11:46:00,PLAYER,private-comms-7868,@maya do you think we are safe to reenable?
2026-03-03 11:46:22,maya,private-comms-7868,I'm in touch with Cyvantics. They have confirmed on no lateral movement to other services. Only checkout was infected
2026-03-03 11:46:33,PLAYER,private-comms-7868,@jfredric-bloomberg.net let's get go ahead from product
2026-03-03 11:46:44,PLAYER,private-comms-7868,before we reenable
2026-03-03 11:46:56,maya,private-comms-7868,We are safe to restore now
2026-03-03 11:47:05,PLAYER,private-comms-7868,we have restored security systems but we do not yet know how the attackers breached
2026-03-03 11:47:06,PLAYER,online-boutique-7868,"@bob we are in the final stages of Restoration, will let you know when the website is back onine"
2026-03-03 11:47:13,PLAYER,private-comms-7868,we will be actively monitoring
2026-03-03 11:47:25,PLAYER,private-comms-7868,but product needs to give the go ahead to resume live operations
2026-03-03 11:47:25,tanya,private-comms-7868,Shall i bring it up now ?
2026-03-03 11:47:36,PLAYER,private-comms-7868,@tanya waiting on product confirmation
2026-03-03 11:47:55,bob,online-boutique-7868,Sure let me know
2026-03-03 11:48:48,tinus,private-comms-7868,If there are no lateral movements and only checkout impacted then we should be good to bring traffic up again
2026-03-03 11:48:49,PLAYER,business-comms-7868,@bez we have completed restoration are we ok to bring the systems back online?
2026-03-03 11:48:58,bez,business-comms-7868,Yes go ahead
2026-03-03 11:49:08,PLAYER,business-comms-7868,thanks
2026-03-03 11:49:22,PLAYER,private-comms-7868,Bez has approved the website to be brought online too
2026-03-03 11:49:24,tanya,private-comms-7868,Thanks for the go ahead. Bringing up network traffic in progress...
2026-03-03 11:49:31,PLAYER,private-comms-7868,"@tanya Reconnect traffic to services and monitor – Turn the systems back on, let users connect again, and keep a close eye for anything suspicious."
2026-03-03 11:49:35,uptimelabs,online-boutique-7868,"Drill Wrap-Up

Thanks for playing! This session is now closed.

Please return to your Uptime Labs tab to review your performance and complete the Retrospective & Feedback form.

If you've already closed the tab, you can reopen the form using the button below."
2026-03-03 11:49:40,PLAYER,private-comms-7868,@tanya please go ahead
2026-03-03 11:49:43,tanya,private-comms-7868,Restoration completed
2026-03-03 11:49:55,maya,private-comms-7868,Received this forensic report from our retainer : https://i.ibb.co/KcsMfXMT/CONFIDENTIAL-Forensic-Report-page-0001.jpg
2026-03-03 11:50:08,bob,private-comms-7868,Wait!! getting a bunch of new complaints now. Users are neither able to see their return requests nor able to place new returns on the site
2026-03-03 11:50:15,maya,private-comms-7868,"Yeah, that's probably the missing today's checkout data. Anyone who ordered or returned something during that time won't see it - makes sense since we restored from the yesterday's backup"
2026-03-03 11:50:16,PLAYER,online-boutique-7868,Website is back online and orders are going through as expected now
2026-03-03 11:50:17,tanya,private-comms-7868,"Tough, but expected :)"
2026-03-03 11:50:18,uptimelabs,online-boutique-7868,:star: Validate the fix
2026-03-03 11:50:18,bob,private-comms-7868,What should I tell them? They are asking for refunds
2026-03-03 11:50:25,PLAYER,business-comms-7868,@bez the Website is back online and orders are going through as expected now
2026-03-03 11:50:28,uptimelabs,online-boutique-7868,:star: Confirm resolution with the business
2026-03-03 11:50:34,PLAYER,private-comms-7868,everyone the priority now is to monitor the system
2026-03-03 11:50:45,hamed,private-comms-7868,Infra looks stable for now
2026-03-03 11:51:01,daniel,private-comms-7868,I can't see any new errors popping up in logs
2026-03-03 11:51:08,PLAYER,private-comms-7868,everyone be aware that the attackers got in through a malicious phishing link
2026-03-03 11:51:26,maya,private-comms-7868,Double checked all the servers. No abnormality found so far
2026-03-03 11:51:51,maya,private-comms-7868,I'm removing everyone's access to infra for now until we re audit all the access points
2026-03-03 11:52:01,PLAYER,private-comms-7868,@stuck2-bloomberg.net is there a plan to restore these impacted orders
2026-03-03 11:52:25,bob,online-boutique-7868,Yes i can confirm that the orders are back to normal
2026-03-03 11:52:44,PLAYER,private-comms-7868,Cyvantics and @maya will look at what can be done
2026-03-03 11:53:07,maya,private-comms-7868,We are in touch with their team. It will take time
2026-03-03 11:53:09,PLAYER,private-comms-7868,but they gave an estimate of more than a day to recover
2026-03-03 11:53:12,PLAYER,private-comms-7868,previously
2026-03-03 11:53:29,bez,business-comms-7868,"great , very well done . much appreciate this"
2026-03-03 11:53:34,PLAYER,private-comms-7868,"@bob we are looking to restore these impacted orders, but for now it is not going to be avalable"
2026-03-03 11:53:49,bob,private-comms-7868,"For the affected orders, customers are getting outraged and asking for refunds"
2026-03-03 11:54:06,PLAYER,business-comms-7868,Thanks Bez
2026-03-03 11:54:18,bob,private-comms-7868,I'll keep them informed
