datetime,player,channel,message
2026-03-03 11:05:23,bez,online-boutique-7868,"What a day! Our Grand Summer Sale kicked off this morning at 10, and the response has been insane. Can't believe we're already 5 hours in"
2026-03-03 11:05:25,bob,online-boutique-7868,"Totally! Just checked the dashboard, we've already crossed $160k+ in revenue :money_mouth_face: . The sale energy is next level!"
2026-03-03 11:05:28,tinus,online-boutique-7868,"That's fantastic, but hey, this is just the beginning. Three days to go... I'm keeping my fingers crossed :crossed_fingers:"
2026-03-03 11:05:31,bez,online-boutique-7868,"Seeing so many people shopping on a holiday, it feels satisfying. Exactly the momentum we were hoping for"
2026-03-03 11:05:33,uptimelabs,online-boutique-7868,"Welcome to DEFCON 1, are you prepared for the challenge?.

 *Access game links by pressing the Uptime Labs Logo in the top right of the screen*
 *Use `/incident` to create an incident record*

Once you're ready just click start to begin"
2026-03-03 11:07:07,PLAYER,online-boutique-7868,@jfredric-bloomberg.net 
2026-03-03 11:07:49,PLAYER,online-boutique-7868,@jfredric-bloomberg.net 
2026-03-03 11:08:28,PLAYER,online-boutique-7868,hello @jfredric-bloomberg.net 
2026-03-03 11:09:27,shay,online-boutique-7868,"Not this time!, I just got a few alerts mentioning severe errors popping up in PROD"
2026-03-03 11:09:30,bob,online-boutique-7868,Weird... a few users just complained they are unable to complete their orders. Feels... off..
2026-03-03 11:10:30,shay,online-boutique-7868,Again i've got an alert
2026-03-03 11:10:44,bob,online-boutique-7868,Reports are climbing
2026-03-03 11:11:52,PLAYER,online-boutique-7868,"Hi, Stephen here I will take charge of this"
2026-03-03 11:11:55,uptimelabs,online-boutique-7868,:star: Take command
2026-03-03 11:12:04,PLAYER,online-boutique-7868,and John is here from an IM capacity
2026-03-03 11:12:21,PLAYER,online-boutique-7868,@shay can you elaborate on the alert you received please
2026-03-03 11:12:30,PLAYER,online-boutique-7868,@lspesshardt-bloomberg.net 
2026-03-03 11:12:37,PLAYER,business-comms-7868,@lspesshardt-bloomberg.net 
2026-03-03 11:12:41,shay,online-boutique-7868,All the alerts are coming in from checkout app
2026-03-03 11:12:43,PLAYER,online-boutique-7868,Also @bob what is the user experience on the website? do they see an error
2026-03-03 11:12:45,uptimelabs,online-boutique-7868,:star: Asking questions to validate impact of the problem
2026-03-03 11:12:52,shay,online-boutique-7868,Around resource exhaustion errors
2026-03-03 11:12:56,bob,online-boutique-7868,"Sure, let me look at my reports"
2026-03-03 11:13:11,bob,online-boutique-7868,Here are some of the complaints we've received in the last few minutes. It's coming all across the globe 
2026-03-03 11:13:13,bob,online-boutique-7868,"Germany - ""I added items to my cart, clicked checkout, and it just kept spinning. Then it dumped me back to an empty cart"""
2026-03-03 11:13:15,bob,online-boutique-7868,"USA - ""Order failed twice, and now the cart is empty. I refreshed, but now the site is laggy"""
2026-03-03 11:13:17,bob,online-boutique-7868,"Japan - ""Got to checkout, then error 502. Tried again - cart gone"""
2026-03-03 11:13:19,bob,online-boutique-7868,"To sum it all, we have got 240+ reports globally"
2026-03-03 11:13:21,bob,online-boutique-7868,
2026-03-03 11:13:38,PLAYER,online-boutique-7868,@jfredric-bloomberg.net can we get the engineers on please
2026-03-03 11:13:53,daniel,online-boutique-7868,I'm in
2026-03-03 11:14:12,daniel,online-boutique-7868,This is definitely impacting users. I couldnt checkout as well
2026-03-03 11:14:17,PLAYER,online-boutique-7868,thanks @daniel can you check if we have any recent releases please
2026-03-03 11:14:21,uptimelabs,online-boutique-7868,:star: Check changes done to the platform
2026-03-03 11:14:22,daniel,online-boutique-7868,Have you raised an incident ?
2026-03-03 11:14:22,PLAYER,online-boutique-7868,@shay do we know which resource is impacted here?
2026-03-03 11:14:33,shay,online-boutique-7868,Here is the list of latest deployments : https://uptime-labs.atlassian.net/wiki/external/YzYwYTAxNWQzOTI0NDYzOWI1MjkxNTI2YmVmMjUyZDE 
2026-03-03 11:14:44,PLAYER,online-boutique-7868,can we get maya. hamed and tanya on please
2026-03-03 11:14:55,PLAYER,online-boutique-7868,
2026-03-03 11:14:55,uptimelabs,business-comms-7868,*Incident Number INC100043:* declaring this as an incident
2026-03-03 11:14:55,uptimelabs,online-boutique-7868,:star: Incident record created
2026-03-03 11:14:55,bez,business-comms-7868,"Hi @Leo - are e running into an issue, i saw few posts on social media"
2026-03-03 11:14:56,PLAYER,online-boutique-7868,we have thousands of customer reports 
2026-03-03 11:14:57,uptimelabs,online-boutique-7868,:star: Send first comms in first 5 minutes
2026-03-03 11:14:59,shay,online-boutique-7868,Alerts are around Checkout app - lots of timeouts and out of memory
2026-03-03 11:14:59,uptimelabs,online-boutique-7868,:star: Qualify the problem
2026-03-03 11:15:00,bez,business-comms-7868,"I'm seeing some posts on social media about issues with our platform, is this a regional issue or hitting customers globally?"
2026-03-03 11:15:04,shay,online-boutique-7868,"For further clarity, looking into logs now"
2026-03-03 11:15:06,tanya,online-boutique-7868,I can help from infra side
2026-03-03 11:15:09,bez,business-comms-7868,Customers have gone outrageous. #OBFail and #OBStealsSale are trending with frustrated posts. We're getting hammered online! Where are we @stuck2-bloomberg.net? 
2026-03-03 11:15:14,shay,online-boutique-7868,Found these below error logs
2026-03-03 11:15:15,shay,online-boutique-7868,"```
app[checkout-service] [ERROR] - write() failed, Read-only filesystem
app[checkout-service] Order submission failed for session_id=ae43f9 due to I/O error
app[checkout-service] [ERROR] - Transaction commit failed, Read-only file system
[ERROR] nginx[3245] - 502 Bad Gateway while accessing upstream checkout service
[ERROR] nginx[3245] - 504 Gateway Timeout while accessing upstream checkout service```"
2026-03-03 11:15:18,PLAYER,business-comms-7868,this looks like a global issue
2026-03-03 11:15:19,PLAYER,business-comms-7868,We are working with the Engineering team to check on this issue
2026-03-03 11:15:19,shay,online-boutique-7868,The server is too slow and give up while responding back. I'm not sure why read-only errors are there
2026-03-03 11:15:25,PLAYER,business-comms-7868,we are investigating at top priority
2026-03-03 11:15:37,daniel,online-boutique-7868,"Looking at the above logs, app looks fine. But system can't write new data. Errors suggests to be an infra component failure"
2026-03-03 11:15:43,hamed,online-boutique-7868,Tanya would be able to do the investigation from infra team. I'll be keeping my attention here in chat as well
2026-03-03 11:15:44,daniel,online-boutique-7868,"Also checkout servers show CPU and memory limits exceeded alerts, this definitely looks bigger than just an app issue"
2026-03-03 11:15:46,daniel,online-boutique-7868,"```app[checkout-service]: systemd[1][WARN] Resource usage threshold exceeded - CPU: 96%, Memory: 92%```"
2026-03-03 11:15:54,shay,online-boutique-7868,Could this be due to load or any changes ?
2026-03-03 11:15:59,daniel,online-boutique-7868,@stuck2-bloomberg.net let us know if you would like us to rollback any changes ?
2026-03-03 11:16:30,bez,business-comms-7868,"Thanks, keep me posted"
2026-03-03 11:16:30,PLAYER,online-boutique-7868,can you post the link to the recent changes @daniel
2026-03-03 11:16:40,bez,business-comms-7868,What does user experience feels like ?
2026-03-03 11:16:50,daniel,online-boutique-7868,https://uptime-labs.atlassian.net/wiki/external/YzYwYTAxNWQzOTI0NDYzOWI1MjkxNTI2YmVmMjUyZDE
2026-03-03 11:17:01,PLAYER,online-boutique-7868,can we check when the errors started coming in
2026-03-03 11:17:07,uptimelabs,online-boutique-7868,:star: Facts over opinion
2026-03-03 11:17:11,PLAYER,online-boutique-7868,we kicked off the sale at 10
2026-03-03 11:17:17,tanya,online-boutique-7868,Checking infra...
2026-03-03 11:17:28,PLAYER,online-boutique-7868,does it correlate with increased traffic or did we see errors prior?
2026-03-03 11:17:35,PLAYER,business-comms-7868,"From internal checks, the users are unable to checkout the items in the cart, they get an error 'Your shopping cart is empty!' when they try to Place Order"
2026-03-03 11:17:38,bob,online-boutique-7868,The complaints started around 20 mins back
2026-03-03 11:17:47,tanya,online-boutique-7868,"All four checkout servers are maxed out - CPU, memory, and disk I/O all spiking. No changes or deployments were done from platform side"
2026-03-03 11:17:48,PLAYER,online-boutique-7868,@maya can we check for any unusual external activity too please
2026-03-03 11:17:52,tanya,online-boutique-7868,
2026-03-03 11:17:55,shay,online-boutique-7868,I can see the alerts firing around 25 mins back
2026-03-03 11:18:07,tanya,online-boutique-7868,Looks like all checkout servers are under huge load . CPU and Memory has spiked up a lot
2026-03-03 11:18:10,maya,online-boutique-7868,"On it, let me do a quick check on our security systems"
2026-03-03 11:18:12,tanya,online-boutique-7868,Shall we try adding more resources to checkout app ?
2026-03-03 11:18:22,bez,business-comms-7868,"That's bad - So, no orders are going thru .Lets get thru this quick"
2026-03-03 11:18:44,PLAYER,online-boutique-7868,we have releases after we started the sale
2026-03-03 11:18:47,maya,online-boutique-7868,"Ok, I went through our SIEM. No security alerts firing. Looks much more like a platform issue to me"
2026-03-03 11:18:53,PLAYER,online-boutique-7868,is it safe to roll those back?
2026-03-03 11:19:08,PLAYER,online-boutique-7868,@shay CHG919047
2026-03-03 11:19:15,PLAYER,online-boutique-7868,Is there any risk with adding more resources?
2026-03-03 11:19:23,PLAYER,online-boutique-7868,@tanya CHG919049
2026-03-03 11:19:25,daniel,online-boutique-7868,All those releases are in non-prod environment
2026-03-03 11:19:42,PLAYER,online-boutique-7868,the environment of the ones i have listed are PROD
2026-03-03 11:19:46,hamed,online-boutique-7868,We can add this up but something is off with these metrics and I cannot explain it with a normal infra failure
2026-03-03 11:20:24,tanya,online-boutique-7868,Both AdService and RecommendationService change wouldn't impact critical order flow
2026-03-03 11:20:37,PLAYER,online-boutique-7868,is it safe to roll back @tanya?
2026-03-03 11:20:40,bez,business-comms-7868,What's the latest ?
2026-03-03 11:20:43,PLAYER,business-comms-7868,"issue for now is suspected to be around the checkout app, we are looking for recent changes and options of adding resources to manage the increase in the user activity"
2026-03-03 11:20:45,tanya,online-boutique-7868,I can do it
2026-03-03 11:20:47,PLAYER,online-boutique-7868,right now we need to restore service
2026-03-03 11:20:49,uptimelabs,online-boutique-7868,:star: Restoration over root cause analysis
2026-03-03 11:20:53,tanya,online-boutique-7868,Doing the rollback now
2026-03-03 11:20:58,PLAYER,online-boutique-7868,we can investigate in the PIR
2026-03-03 11:21:10,PLAYER,online-boutique-7868,@shay can we roll yours back safely too?
2026-03-03 11:21:26,PLAYER,online-boutique-7868,@daniel is there any chance that the UAT env can spill into prod?
2026-03-03 11:21:28,hamed,online-boutique-7868,"Four things standing out:
1. Disk I/O writes are maxed out but reads are completely flat — not a pattern you see with a degraded volume
2. CPU spiked simultaneously across all four checkout servers around same time — infra failures cascade, they do not strike all nodes at once
3. Incoming user traffic does not explain any of this — resource consumption is way beyond what the request volume would justify"
2026-03-03 11:21:40,tanya,online-boutique-7868,I've rolled back my change
2026-03-03 11:21:52,bez,business-comms-7868,"OKay, User activity is high .Okay, we have a stake holders meet in 15 minutes , let me know if this can be resolved before that"
2026-03-03 11:21:53,shay,online-boutique-7868,I've rolled back my change as well
2026-03-03 11:22:05,shay,online-boutique-7868,Has it made any differene ?
2026-03-03 11:22:33,daniel,online-boutique-7868,UAT changes will not spill over to prod. I checked the logs
2026-03-03 11:22:52,daniel,online-boutique-7868,This looks like an abnormal issue
2026-03-03 11:23:06,PLAYER,online-boutique-7868,From the Dashboards we still see an inflow of orders. @bob are there still client complaints
2026-03-03 11:23:12,tanya,online-boutique-7868,There is a process here I do not recognise - consuming max CPU. Not something we run from platform side
2026-03-03 11:23:19,tanya,online-boutique-7868,https://assets.prod.uptimelabs.io/drill-assets/30/process-Running.webp
2026-03-03 11:23:21,PLAYER,online-boutique-7868,can we get an update on user status from @bob 
2026-03-03 11:23:24,uptimelabs,online-boutique-7868,:star: Manage actions and timings
2026-03-03 11:23:29,bob,online-boutique-7868,"Yes, 300+ reports"
2026-03-03 11:23:33,PLAYER,online-boutique-7868,I can still replicate the issue on the online Boutique
2026-03-03 11:23:35,uptimelabs,online-boutique-7868,:star: Reproduces the incident
2026-03-03 11:24:03,PLAYER,online-boutique-7868,@daniel and others do you recognise the process from @tanya's link?
2026-03-03 11:24:03,PLAYER,business-comms-7868,"Sure Bez, we have rolled the changes that went in recently"
2026-03-03 11:24:04,tanya,online-boutique-7868,Thats definitely suspicious to me. @Hamed do you recognise this?
2026-03-03 11:24:16,hamed,online-boutique-7868,Never seen it. Not something from platform side
2026-03-03 11:24:22,PLAYER,business-comms-7868,doesn't look like thats the cause of this issue 
2026-03-03 11:24:22,daniel,online-boutique-7868,Not even from app side
2026-03-03 11:24:28,PLAYER,business-comms-7868,ENG teams continue to investigate
2026-03-03 11:24:50,PLAYER,online-boutique-7868,do we think it is safe to kill?
2026-03-03 11:24:52,hamed,online-boutique-7868,We should bring in SecOps into this
2026-03-03 11:25:06,tanya,online-boutique-7868,Yes Maya could explain this process
2026-03-03 11:25:09,uptimelabs,online-boutique-7868,:bulb: You have support from other more experienced colleagues when needed
2026-03-03 11:25:16,PLAYER,online-boutique-7868,@maya can you advice on this please
2026-03-03 11:25:25,maya,online-boutique-7868,Looping back in after seeing Tanya's message. Let me go much deeper this time. Give me a few minutes
2026-03-03 11:25:31,PLAYER,online-boutique-7868,Thanks 
2026-03-03 11:25:55,maya,online-boutique-7868,"OK I was wrong. EDR agent is completely gone from all four checkout servers ? binary itself removed, not stopped. Nothing fired on SIEM. Detection was blind, it looked like a platform issue"
2026-03-03 11:25:58,bez,business-comms-7868,"Got an email claiming responsibility by ""BlackCrow Group"" and demanding payment of $5M in crypto. Honestly, I get these hoax emails all the time, so I'm not buying it"
2026-03-03 11:25:59,maya,online-boutique-7868,"```EDR is basically our endpoint defense tool, it tracks unusual activity at the servers```"
2026-03-03 11:26:15,maya,online-boutique-7868,Also found this. @Tanya as you mentioned - this init_locker.sh script actively renaming files across the checkout servers
2026-03-03 11:26:16,maya,online-boutique-7868,"```
order_log_2025-06-01.locked
session_state.tmp.locked```"
2026-03-03 11:26:18,PLAYER,online-boutique-7868,how could EDR agent be removed?
2026-03-03 11:26:22,daniel,online-boutique-7868,That explains everything ? the write failed and read-only filesystem errors. Something was encrypting files as the app was trying to write to them
2026-03-03 11:26:27,tanya,online-boutique-7868,"Wait... while you were checking that, I found something on the server. There is a file named HELP_ME_DECRYPT.txt sitting in /var/www/html/. That name is not normal"
2026-03-03 11:26:29,tanya,online-boutique-7868,
2026-03-03 11:26:33,tanya,online-boutique-7868,I think this is a ransom note
2026-03-03 11:26:37,maya,online-boutique-7868,The attacker removed EDR first specifically so our SIEM would stay blind. This was designed to look like an infra issue. That is a deliberate tactic
2026-03-03 11:26:42,maya,online-boutique-7868,Confirmed. This is a ransomware breach. @stuck2-bloomberg.net inform business about this. I'm checking further...
2026-03-03 11:26:43,tanya,online-boutique-7868,Shall I try killing this script ?
2026-03-03 11:26:47,bob,online-boutique-7868,"Guys!!! User complaints are sky rocketing, its turning catastrophic!"
2026-03-03 11:26:53,shay,online-boutique-7868,"We must get this script killed asap, might help in stabilising the systems instantly"
2026-03-03 11:27:00,PLAYER,online-boutique-7868,@bob we should consider shutting down the site
2026-03-03 11:27:14,PLAYER,online-boutique-7868,"From the business comms chat 

Bez Jeffos

[6:25 AM](https://comms.prod.uptimelabs.io/bloomberg-net/pl/t7i73zptjifkzgwrsoce85hbrr)

Got an email claiming responsibility by ""BlackCrow Group"" and demanding payment of $5M in crypto. Honestly, I get these hoax emails all the time, so I'm not buying it"
2026-03-03 11:27:26,PLAYER,online-boutique-7868,@jfredric-bloomberg.net can you conf from Bez that we should shut the site
2026-03-03 11:27:33,PLAYER,online-boutique-7868,thanks John
2026-03-03 11:27:38,bob,online-boutique-7868,"Yes , the reports are rising up a lot. My team is informing users . Is there anything specific shall i say to users ?"
2026-03-03 11:27:41,PLAYER,online-boutique-7868,we are seeing actual impact to customers
2026-03-03 11:27:43,PLAYER,online-boutique-7868,Ack checking now
2026-03-03 11:27:54,PLAYER,business-comms-7868,"Bez, this looks like the cause of the issue"
2026-03-03 11:27:57,tanya,online-boutique-7868,Shall i kill this script asap ?
2026-03-03 11:28:01,bez,business-comms-7868,Whatt
2026-03-03 11:28:04,PLAYER,online-boutique-7868,my advice is to shut the site before we get into financial actions with customers that are incorrect
2026-03-03 11:28:07,PLAYER,business-comms-7868,are we ok to shut the site down to get this fixed
2026-03-03 11:28:11,bez,business-comms-7868,Wait! you're telling me this is an actual ransomware hit?
2026-03-03 11:28:38,PLAYER,online-boutique-7868,@maya what is your advice from a security standpoint?  do we need to get more staff on?
2026-03-03 11:28:38,PLAYER,business-comms-7868,"Unfortunately, yes"
2026-03-03 11:28:43,maya,online-boutique-7868,"Killing the script could make things worse, higher ransom or losing data forever"
2026-03-03 11:28:48,bez,business-comms-7868,This is nightmare! @stuck2-bloomberg.net where are we right now?
2026-03-03 11:28:49,maya,online-boutique-7868,"@stuck2-bloomberg.net before we do anything, I'd request everyone to please change their passwords"
2026-03-03 11:28:53,maya,online-boutique-7868,Also I'm removing everyone's access to servers - only I'll have control for now. Later we will reassess to do any activity further
2026-03-03 11:28:58,daniel,online-boutique-7868,Done on my end
2026-03-03 11:28:58,bez,business-comms-7868,"Go Ahead - make your best judgement , Maya is our SME ,"
2026-03-03 11:29:01,hamed,online-boutique-7868,Updated. @Maya smart move by limiting server's access
2026-03-03 11:29:03,PLAYER,business-comms-7868,the SecOps team and Platform are working on getting it sorted now
2026-03-03 11:29:04,shay,online-boutique-7868,Password updated
2026-03-03 11:29:07,bob,online-boutique-7868,Changed mine too. Better safe than sorry
2026-03-03 11:29:08,PLAYER,business-comms-7868,[](url)ack
2026-03-03 11:29:09,bez,business-comms-7868,@John
2026-03-03 11:29:11,tanya,online-boutique-7868,All set
2026-03-03 11:29:18,tanya,online-boutique-7868,"It's much worse now. Every file I check is encrypted, nothing can be opened or recovered."
2026-03-03 11:29:22,shay,online-boutique-7868,I'm seeing new errors on frontend now. How's it for you @stuck2-bloomberg.net ?
2026-03-03 11:29:28,PLAYER,online-boutique-7868,"Bez, is ok for us to take action as needed to get this fixed"
2026-03-03 11:29:33,maya,online-boutique-7868,"Attention! when it comes to potential security breaches, it's important we don't discuss sensitive details here"
2026-03-03 11:29:34,PLAYER,business-comms-7868,"@bez i am handling engineering response, John will post updates here"
2026-03-03 11:29:38,maya,online-boutique-7868,I'm setting up private channel...
2026-03-03 11:29:43,maya,online-boutique-7868,"@stuck2-bloomberg.net before we move to private channel, can you check with business what's the plan - are we paying the ransom or moving with response?"
2026-03-03 11:30:21,PLAYER,online-boutique-7868,@maya that should be discussed in a private channel not in here
2026-03-03 11:30:23,maya,online-boutique-7868,Are we moving with the response ?
2026-03-03 11:30:40,maya,online-boutique-7868,Creating it
2026-03-03 11:30:45,PLAYER,business-comms-7868,@bez wanted to confirm if we are paying the ransom or moving with response?
2026-03-03 11:30:52,bez,business-comms-7868,"Not in favor of paying. Ethically, it sets the wrong example and there's no real guarantee we'll get anything back"
2026-03-03 11:30:54,tinus,business-comms-7868,"Agree. Also, just to be clear - we don't need to alert the ICO(Information Commissioner's Office) right this second. We've got up to 72 hours, but that depends on how serious this really is"
2026-03-03 11:30:58,PLAYER,business-comms-7868,"Ack, thanks"
2026-03-03 11:31:10,PLAYER,online-boutique-7868,"Yes, got the go-ahead from Bez"
2026-03-03 11:31:11,maya,private-comms-7868,@stuck2-bloomberg.net let's build the core response team here. I've already added myself. Who else should we pull in to keep it tight and efficient?
2026-03-03 11:31:15,maya,private-comms-7868,"I'd say one senior person each from security, platform, and engineering. Also add Tanya, tasks could be platform intensive"
2026-03-03 11:31:17,PLAYER,online-boutique-7868,to move with the response
2026-03-03 11:31:19,PLAYER,online-boutique-7868,@john can we get more security staff on please
2026-03-03 11:31:19,bez,business-comms-7868,@Tinus do you think this is something we should loop in any cyber security agency for?
2026-03-03 11:31:22,tinus,business-comms-7868,"If it looks like a complete lock-out, I'd say yes"
2026-03-03 11:31:22,hamed,private-comms-7868,I'm here
2026-03-03 11:31:25,tinus,business-comms-7868,"We've got Cyvantics Security on retainer - just in case this gets out of hand. @stuck2-bloomberg.net, ask Maya to reach out if needed"
2026-03-03 11:31:28,daniel,private-comms-7868,Lets do it
2026-03-03 11:31:35,tanya,private-comms-7868,I'm in as well
2026-03-03 11:31:37,PLAYER,private-comms-7868,please add @jfredric-bloomberg.net 
2026-03-03 11:31:57,PLAYER,private-comms-7868,im here
2026-03-03 11:31:57,PLAYER,private-comms-7868,I'd like more security staff in here too
2026-03-03 11:32:19,maya,private-comms-7868,"Yes, we've got an IR(incident response) retainer with Cyvantics Security"
2026-03-03 11:32:27,PLAYER,online-boutique-7868,lets get  Cyvantics Security on please
2026-03-03 11:32:32,bez,business-comms-7868,@stuck2-bloomberg.net I need a clear answer from the team. What exactly is affected right now?
2026-03-03 11:32:34,maya,private-comms-7868,"Looped in Cyvantics Security - they're on their way now to take snapshots of the infected server and storage, followed by forensics on it"
2026-03-03 11:32:35,tinus,business-comms-7868,"You're right. We need clear facts - which systems are locked, which are safe"
2026-03-03 11:32:44,maya,private-comms-7868,"Meanwhile, I've got this from Cyvantics. @stuck2-bloomberg.net, can you help track the steps and coordinate?"
2026-03-03 11:32:46,maya,private-comms-7868,https://uptime-labs.atlassian.net/wiki/external/MThjMTk4ZDU5ODU0NGZmMWE1NzhmNGY0MDQwNWI1NTA
2026-03-03 11:32:51,maya,private-comms-7868,"We've got isolation steps in the playbook, but before we dive in, can you paste that list here? I'll help team run through it"
2026-03-03 11:33:07,PLAYER,private-comms-7868,@tinus adding you here for adivce
2026-03-03 11:33:09,uptimelabs,online-boutique-7868,:star: Escalating when required
2026-03-03 11:33:10,bez,business-comms-7868,@stuck2-bloomberg.net Have you informed everyone in team? No one says a single thing outside online-boutique!
2026-03-03 11:33:23,PLAYER,private-comms-7868,@lspesshardt-bloomberg.net 
2026-03-03 11:33:30,PLAYER,private-comms-7868,FYI Adding leo
2026-03-03 11:33:37,tinus,private-comms-7868,Sure i'm in here . Feel to ask me out anytime. You've got this team
2026-03-03 11:34:02,PLAYER,private-comms-7868,@maya who should run those steps?
2026-03-03 11:34:02,maya,private-comms-7868,Shall we start with the isolation now ?
2026-03-03 11:34:10,PLAYER,business-comms-7868,We have a private channel now open and investigating this to ensure there is no further security risk
2026-03-03 11:34:27,maya,private-comms-7868,We all of us will run it. You just have to track them for us
2026-03-03 11:34:48,maya,private-comms-7868,"I've given write access to Tanya, Hamed, Daniel, and myself"
2026-03-03 11:34:49,bob,online-boutique-7868,"@stuck2-bloomberg.net user complaints are spiking. They're reporting the site is down, earlier it wasn't the case. What should I tell them now?"
2026-03-03 11:34:50,bez,business-comms-7868,"Okay, Keep me updated here for any critical decisions"
2026-03-03 11:34:52,tanya,private-comms-7868,Disconnecting the checkout servers from the infra now
2026-03-03 11:34:54,daniel,private-comms-7868,I'm on it. Disconnecting DB access for checkout and checking if scheduled backups exist
2026-03-03 11:34:56,hamed,private-comms-7868,I'll verify if any shared storage is still attached to the checkout DB
