index,datetime,player,channel,message
212,19/11/2025 12:24,player5,business-comms-6826,security agents (EDR) on checkout servers were re-enabled
213,19/11/2025 12:24,Hamed,private-comms-6826,I have completed Step 2 as well
214,19/11/2025 12:24,player5,online-boutique-6826,Bob you should have the latest information from <#C09UAU4Q3K3|>. let me know if further updates are needed.
215,19/11/2025 12:25,Bez,business-comms-6826,Whats the ETA
216,19/11/2025 12:25,Tanya,private-comms-6826,Shall i reconnect back to network ?
217,19/11/2025 12:25,player5,business-comms-6826,teams are working to bring the traffic back let me get an ETA
218,19/11/2025 12:26,player5,private-comms-6826,Maya Tanya Hamed S any ETA for full mitigation?
219,19/11/2025 12:26,Maya,private-comms-6826,2 to 5 minutes if all goes well
220,19/11/2025 12:26,Maya,private-comms-6826,we should go ahead and reconnect now @tanya
221,19/11/2025 12:26,Tanya,private-comms-6826,Thanks for the go ahead. Bringing up network traffic in progress...
222,19/11/2025 12:26,player5,private-comms-6826,Bob any updates on the impacted orders number?
223,19/11/2025 12:26,Tanya,private-comms-6826,Restoration completed
224,19/11/2025 12:26,Bob,private-comms-6826,We have had more than 16k orders that are unfulfilled
225,19/11/2025 12:27,player5,business-comms-6826,ETA provided: 2 to 5 minutes if all goes well
226,19/11/2025 12:27,Bob,private-comms-6826,Wait!! getting a bunch of new complaints now. Users are neither able to see their return requests nor able to place new returns on the site
227,19/11/2025 12:27,player5,private-comms-6826,Maya i can confirm all tasks have been completed.
228,19/11/2025 12:27,Maya,private-comms-6826,Yeah that's probably the missing today's checkout data. Anyone who ordered or returned something during that time won't see it - makes sense since we restored from the yesterday's backup
229,19/11/2025 12:27,Tanya,private-comms-6826,Tough but expected :)
230,19/11/2025 12:27,player5,business-comms-6826,Bez just an FYI 16k orders that are unfulfilled will be lost.
231,19/11/2025 12:27,Bob,private-comms-6826,What should I tell them? They are asking for refunds
233,19/11/2025 12:27,player5,private-comms-6826,Are we now back to normal?
234,19/11/2025 12:28,Bob,private-comms-6826,Checking- Site looks up now
235,19/11/2025 12:28,player5,private-comms-6826,Bob what's the best way moving forward? is approval from Bez required for confirming refunds?
236,19/11/2025 12:28,Bob,private-comms-6826,Can you verify please
237,19/11/2025 12:28,Bob,private-comms-6826,Thats right - please check with Bez
238,19/11/2025 12:28,player5,online-boutique-6826,As of 12:28 Site looks up now
239,19/11/2025 12:28,player5,business-comms-6826,As of 12:28 Site looks up now
240,19/11/2025 12:28,Bez,business-comms-6826,Perfect
241,19/11/2025 12:29,player5,business-comms-6826,a question Bez fans are asking for refunds; any feedback I can pass onto Bob?
242,19/11/2025 12:29,Bez,business-comms-6826,i did follow the chat about refunds
243,19/11/2025 12:29,Bez,business-comms-6826,Keeping it high-level just say website restored but there's an issue with few orders. We'll refund them and customers will get a $10 gift voucher as an apology
244,19/11/2025 12:29,Maya,private-comms-6826,@player5 I've received the forensics report from Cyvantics Security
245,19/11/2025 12:29,Maya,private-comms-6826,forensics
246,19/11/2025 12:30,Maya,private-comms-6826,Also I just finished combing through Shay's mailbox. There's something important here I found two emails from what looks like our monitoring vendor - ClearTech
247,19/11/2025 12:30,Maya,private-comms-6826,phished_email
248,19/11/2025 12:30,player5,private-comms-6826,Bob It was suggested to refund them and provide customers a $10 gift voucher as an apology
249,19/11/2025 12:30,Maya,private-comms-6826,We will take this forward in PIR  for now website is restored
250,19/11/2025 12:30,Bob,private-comms-6826,Noted  thanks
252,19/11/2025 12:30,Maya,private-comms-6826,Alright since everything's back up and stable we can now move back to the main #online-boutique channel. No further actions left here
253,19/11/2025 12:30,Maya,online-boutique-6826,Do we go ahead and mark this incident as closed?
254,19/11/2025 12:30,player5,private-comms-6826,Maya can the team work on restoring todays checkout data to ensure service is fully restored
255,19/11/2025 12:30,player5,business-comms-6826,thanks Bez just an FYI that the forensics report from Cyvantics Security was received; teams will analyze it
256,19/11/2025 12:31,Maya,private-comms-6826,I think we have lost that data
257,19/11/2025 12:31,Bez,business-comms-6826,Thanks we must have preventive measures
258,19/11/2025 12:31,player5,private-comms-6826,Are we happy to now resolve the incident?
259,19/11/2025 12:31,Maya,private-comms-6826,yes
260,19/11/2025 12:32,Hamed,private-comms-6826,yeah
261,19/11/2025 12:32,Bez,business-comms-6826,Since services are restored I'm heading to speak with compliance and the regulators. Thankfully no data was leaked that helps
262,19/11/2025 12:32,player5,private-comms-6826,player5 there were approx. 16k orders lost;we have a plan to refund (+ gift card)
263,19/11/2025 12:32,Tanya,online-boutique-6826,That was intense. We've never been this close to total loss before. We got lucky
264,19/11/2025 12:32,Tinus,business-comms-6826,I'm on my way to the ICO (Information Commissioner's Office - UK) office now. I'll get the formal report rolling - that's required for the insurance claim. Keep monitoring in the meantime
265,19/11/2025 12:32,player5,online-boutique-6826,resolve
266,19/11/2025 12:32,player5,business-comms-6826,*Incident Number INC100099:* resolve
267,19/11/2025 12:32,Daniel,online-boutique-6826,Systems are calm now but that feeling earlier... not something I want to go through again
268,19/11/2025 12:32,Bob,online-boutique-6826,One small slip caused a major breach. We need better awareness to prevent this in future
269,19/11/2025 12:32,Tinus,online-boutique-6826,This could've gone way worse. Appreciate how quickly and cleanly you handled it
270,19/11/2025 12:32,Bez,online-boutique-6826,"Not every day we survive an attack like this. You made the right calls fast. Great job @player5 - that's how we bounce back\n"""