index,datetime,player,channel,message
222,09/10/2025 10:30,Maya,private-comms-6250,@player6 I've received the forensics report from Cyvantics Security
223,09/10/2025 10:30,Maya,private-comms-6250,forensics
224,09/10/2025 10:30,player6,private-comms-6250,website restored but there's an issue with few orders. We'll refund them and customers will get a $10 gift voucher as an apology Bob
225,09/10/2025 10:30,Maya,private-comms-6250,Also I just finished combing through Shay's mailbox. There's something important here I found two emails from what looks like our monitoring vendor - ClearTech
226,09/10/2025 10:30,Maya,private-comms-6250,phished_email
227,09/10/2025 10:30,Maya,private-comms-6250,We will take this forward in PIR  for now website is restored
228,09/10/2025 10:30,Maya,private-comms-6250,Alright since everything's back up and stable we can now move back to the main #online-boutique channel. No further actions left here
229,09/10/2025 10:31,Maya,online-boutique-6250,Do we go ahead and mark this incident as closed?
230,09/10/2025 10:31,player6,private-comms-6250,thank you all
231,09/10/2025 10:31,player6,online-boutique-6250,can we do one final sweep
232,09/10/2025 10:31,player6,business-comms-6250,thank you
233,09/10/2025 10:31,Daniel,online-boutique-6250,All systems look healthy
234,09/10/2025 10:31,player6,business-comms-6250,we also have found the source of infection
235,09/10/2025 10:31,Tanya,online-boutique-6250,Platform looks fine too
236,09/10/2025 10:31,player6,online-boutique-6250,thank you all
237,09/10/2025 10:31,player6,online-boutique-6250,we can close this
238,09/10/2025 10:31,Bez,business-comms-6250,Since services are restored I'm heading to speak with compliance and the regulators. Thankfully no data was leaked that helps
239,09/10/2025 10:31,Tanya,online-boutique-6250,That was intense. We've never been this close to total loss before. We got lucky
240,09/10/2025 10:32,Tinus,business-comms-6250,I'm on my way to the ICO (Information Commissioner's Office - UK) office now. I'll get the formal report rolling - that's required for the insurance claim. Keep monitoring in the meantime
241,09/10/2025 10:32,Daniel,online-boutique-6250,Systems are calm now but that feeling earlier... not something I want to go through again
242,09/10/2025 10:32,Bob,online-boutique-6250,One small slip caused a major breach. We need better awareness to prevent this in future
243,09/10/2025 10:32,Tinus,online-boutique-6250,This could've gone way worse. Appreciate how quickly and cleanly you handled it
244,09/10/2025 10:32,Bez,online-boutique-6250,Not every day we survive an attack like this. You made the right calls fast. Great job @player6 - that's how we bounce back
246,09/10/2025 10:32,player6,online-boutique-6250,Clicked Start_feedback button\n