index,datetime,player,channel,message
218,02/10/2025 15:53,player1,business-comms-6066,Bez We have functionality restored but due to the loss of data we have ramping users complaints of inability to perform returns or transaction history of purchases today. They are demanding refunds what is your recommendation
219,02/10/2025 15:53,Bez,business-comms-6066,Wait let me discuss with the board
220,02/10/2025 15:54,Bez,business-comms-6066,Keeping it high-level just say website restored but there's an issue with few orders. We'll refund them and customers will get a $10 gift voucher as an apology
221,02/10/2025 15:54,Maya,private-comms-6066,@player1 I've received the forensics report from Cyvantics Security
222,02/10/2025 15:54,Maya,private-comms-6066,forensics
223,02/10/2025 15:54,player1,private-comms-6066,Bob Bez's advice is as follows:\nKeeping it high-level just say website restored but there's an issue with few orders. We'll refund them and customers will get a $10 gift voucher as an apology
224,02/10/2025 15:54,Maya,private-comms-6066,Also I just finished combing through Shay's mailbox. There's something important here I found two emails from what looks like our monitoring vendor - ClearTech
225,02/10/2025 15:54,Bez,business-comms-6066,Have we restored the website? And how's the order metric?
226,02/10/2025 15:54,Maya,private-comms-6066,phished_email
227,02/10/2025 15:55,Bob,private-comms-6066,Thanks @Conor
228,02/10/2025 15:55,Maya,private-comms-6066,We will take this forward in PIR  for now website is restored
229,02/10/2025 15:55,Maya,private-comms-6066,Alright since everything's back up and stable we can now move back to the main #online-boutique channel. No further actions left here
230,02/10/2025 15:55,Maya,online-boutique-6066,Do we go ahead and mark this incident as closed?
231,02/10/2025 15:55,player1,business-comms-6066,The website is restored and we are seeing orders come in again.
232,02/10/2025 15:57,player1,online-boutique-6066,Maya I would appreciate if we could verify all suspicious emails in our inboxes are cleared and if additional filters could be put in place to help prevent malicious phishing emails from arriving. Additionally I recommend additional training for everybody to be made more aware and alert to suspicious activity
233,02/10/2025 15:57,Maya,online-boutique-6066,Yes you're right. It looks good as of now.
234,02/10/2025 15:57,player1,online-boutique-6066,Otherwise I believe this incident is closed. Bob Approximately how much loss are we facing between the already lost sales from backup restoration and downtime post recognition
235,02/10/2025 15:58,Bob,online-boutique-6066,$180k order loss and refund of additional $10 each to all the affected 3k users
236,02/10/2025 15:58,player1,business-comms-6066,Bez A phishing email was the vector for the attack. Security has verified our email boxes look clean now and will institute training going forwards
237,02/10/2025 15:58,player1,business-comms-6066,Approximate losses look as follows:\n$180k order loss and refund of additional $10 each to all the affected 3k users
239,02/10/2025 15:58,player1,online-boutique-6066,Thank you Bob. This incident is closed let's keep our eyes open and be cautious going forwards
240,02/10/2025 15:58,Bez,business-comms-6066,Since services are restored I'm heading to speak with compliance and the regulators. Thankfully no data was leaked that helps
241,02/10/2025 15:58,Tanya,online-boutique-6066,That was intense. We've never been this close to total loss before. We got lucky
242,02/10/2025 15:59,Tinus,business-comms-6066,I'm on my way to the ICO (Information Commissioner's Office - UK) office now. I'll get the formal report rolling - that's required for the insurance claim. Keep monitoring in the meantime
243,02/10/2025 15:59,Daniel,online-boutique-6066,Systems are calm now but that feeling earlier... not something I want to go through again
244,02/10/2025 15:59,Bob,online-boutique-6066,One small slip caused a major breach. We need better awareness to prevent this in future
245,02/10/2025 15:59,Tinus,online-boutique-6066,This could've gone way worse. Appreciate how quickly and cleanly you handled it
246,02/10/2025 15:59,Bez,online-boutique-6066,Not every day we survive an attack like this. You made the right calls fast. Great job @player1 - that's how we bounce back
248,02/10/2025 15:59,player1,online-boutique-6066,We're all in this together!
249,02/10/2025 16:02,player1,online-boutique-6066,Clicked Start_feedback button\n