index,datetime,player,channel,message
212,2026-02-06 08:05:52,PLAYER,online-boutique-7644,"I am talking to bez for an approval"
213,2026-02-06 08:05:58,PLAYER,business-comms-7644,"@bez the DC1 recovery due to AC units is going to take about 8 hours. If our DC2 encounters an issue we don't have a failover option ready. \nWe need to spin up AWS instances and keep them ready just in case. If we try to do that during a disaster it ll take upwards of 2 hours to recitfy. \n\nHowever Hamed says it's a costly affair. What're your thoughts?"
214,2026-02-06 08:06:05,PLAYER,business-comms-7644,"I am trying to get an estimate currently"
215,2026-02-06 08:06:14,hamed@localhost,online-boutique-7644,"Around $7-8k hourly"
216,2026-02-06 08:06:22,hamed@localhost,online-boutique-7644,"And would depend on the traffic as well"
217,2026-02-06 08:06:45,PLAYER,business-comms-7644,"It would cost about 7-8k $ per hour"
218,2026-02-06 08:07:00,hamed@localhost,online-boutique-7644,"If more traffic then we would need extra storages and balancers. At max $15k hourly if traffic hits 4k request per min"
219,2026-02-06 08:07:06,bez@localhost,business-comms-7644,"You've got my go-ahead for AWS. Its good to be proactive"
220,2026-02-06 08:07:18,PLAYER,business-comms-7644,"Alright"
221,2026-02-06 08:07:19,tinus@localhost,business-comms-7644,"This is good"
222,2026-02-06 08:07:31,PLAYER,business-comms-7644,"f more traffic then we would need extra storages and balancers. At max $15k hourly if traffic hits 4k request per min"
223,2026-02-06 08:07:35,PLAYER,business-comms-7644,"*if"
224,2026-02-06 08:07:43,PLAYER,business-comms-7644,"are we good with that?"
225,2026-02-06 08:07:44,tanya@localhost,online-boutique-7644,"I'm going to work on getting is cloud setup"
226,2026-02-06 08:07:53,bez@localhost,business-comms-7644,"Yes"
227,2026-02-06 08:08:14,hamed@localhost,online-boutique-7644,"Have we got the approval ?"
228,2026-02-06 08:08:22,PLAYER,online-boutique-7644,"I have got a go ahead from Bez. let's prep the AWS instances"
229,2026-02-06 08:08:47,hamed@localhost,online-boutique-7644,"Ok we are doing it. In the meantime we can close this if you're ok ?"
230,2026-02-06 08:09:03,tanya@localhost,online-boutique-7644,"Great work everyone i think that's us for now"
231,2026-02-06 08:09:05,shay@localhost,online-boutique-7644,"Wow that was definitely stressful but well done"
232,2026-02-06 08:09:07,tinus@localhost,online-boutique-7644,"i look forward to the PIR on this"
233,2026-02-06 08:09:08,daniel@localhost,online-boutique-7644,"Absolutely Shay! I'm positive i've aged 3 years during that"
234,2026-02-06 08:09:13,bez@localhost,online-boutique-7644,"Everyone great work on restoring the platform"
235,2026-02-06 08:09:18,bez@localhost,online-boutique-7644,"i would also like to apologise to @chandan.nagaraja-thomsonreuters.com i put a lot of pressure of you when i shouldn't have"
236,2026-02-06 08:09:23,bez@localhost,online-boutique-7644,"You did amazing anyways under the circumstances as to everyone else on this amazing team."
237,2026-02-06 08:09:28,tanya@localhost,online-boutique-7644,"No worries Bez it can happen to the best of us"
238,2026-02-06 08:09:31,maya@localhost,online-boutique-7644,"I do agree that we have an amazing team"
239,2026-02-06 08:09:34,daniel@localhost,online-boutique-7644,"As i always say ""living the dream"
240,2026-02-06 08:09:38,shay@localhost,online-boutique-7644,"You stole that quote from Craig who used to work here"
241,2026-02-06 08:09:41,daniel@localhost,online-boutique-7644,"True but i was hoping no one would notice"
242,2026-02-06 08:09:47,bez@localhost,online-boutique-7644,"We all noticed Daniel but anyways that's a wrap. Well done team!!"
243,2026-02-06 08:09:58,PLAYER,online-boutique-7644,"@hamed yes let's close this"
244,2026-02-06 08:10:01,uptimelabs@localhost,online-boutique-7644,"Thank you for playing 'Breaking Bez' We recommend that you take 5 minutes to go and get a drink or stretch your legs.\nOnce you are back we ask that you complete this retrospective and feedback form just hit start when you are ready."
245,2026-02-06 08:10:09,uptimelabs@localhost,online-boutique-7644,"Thanks for playing! Please complete your feedback here:\nhttps://learn.uptimelabs.io/scenario/online-boutique/levels/24/7644/feedback"\n"