index,datetime,player,channel,message
205,2025-10-24 09:42:40,Tinus,business-comms-6440,"I'm on my way to the ICO (Information Commissioner's Office - UK) office now. I'll get the formal report rolling - that's required for the insurance claim. Keep monitoring in the meantime"
206,2025-10-24 09:42:41,Daniel,online-boutique-6440,"Systems are calm now but that feeling earlier... not something I want to go through again"
207,2025-10-24 09:42:44,Bob,online-boutique-6440,"One small slip caused a major breach. We need better awareness to prevent this in future"
208,2025-10-24 09:42:46,Tinus,online-boutique-6440,"This could've gone way worse. Appreciate how quickly and cleanly you handled it"
209,2025-10-24 09:42:50,Bez,online-boutique-6440,"Not every day we survive an attack like this. You made the right calls fast. Great job @Suraj Jajoo - that's how we bounce back"
211,2025-10-24 09:43:15,PLAYER,business-comms-6440,"Cool!\nThe incident is resolved"
212,2025-10-24 09:43:17,PLAYER,online-boutique-6440,"Clicked Start_feedback button\n"