index,datetime,player,channel,message
221,25/11/2025 13:47,Bez,business-comms-6889,Since services are restored I'm heading to speak with compliance and the regulators. Thankfully no data was leaked that helps
222,25/11/2025 13:47,Tanya,online-boutique-6889,That was intense. We've never been this close to total loss before. We got lucky
223,25/11/2025 13:47,Tinus,business-comms-6889,I'm on my way to the ICO (Information Commissioner's Office - UK) office now. I'll get the formal report rolling - that's required for the insurance claim. Keep monitoring in the meantime
224,25/11/2025 13:47,Daniel,online-boutique-6889,Systems are calm now but that feeling earlier... not something I want to go through again
225,25/11/2025 13:47,Bob,online-boutique-6889,One small slip caused a major breach. We need better awareness to prevent this in future
226,25/11/2025 13:47,Tinus,online-boutique-6889,This could've gone way worse. Appreciate how quickly and cleanly you handled it
227,25/11/2025 13:47,player2,business-comms-6889,Bob are you able to tell the customers the above from Bez please?
228,25/11/2025 13:47,Bez,online-boutique-6889,Not every day we survive an attack like this. You made the right calls fast. Great job @player2 - that's how we bounce back
230,25/11/2025 13:48,player2,online-boutique-6889,Clicked Start_feedback button\n