index,datetime,player,channel,message
206,21/11/2025 13:06,Bez,business-comms-6861,Keeping it high-level just say website restored but there's an issue with few orders. We'll refund them and customers will get a $10 gift voucher as an apology
207,21/11/2025 13:06,Maya,private-comms-6861,@player1 I've received the forensics report from Cyvantics Security
208,21/11/2025 13:06,Maya,private-comms-6861,forensics
209,21/11/2025 13:06,player1,private-comms-6861,player1 We'll refund them and customers will get a $10 gift voucher as an apology
210,21/11/2025 13:06,Maya,private-comms-6861,Also I just finished combing through Shay's mailbox. There's something important here I found two emails from what looks like our monitoring vendor - ClearTech
211,21/11/2025 13:06,Maya,private-comms-6861,phished_email
212,21/11/2025 13:07,Maya,private-comms-6861,We will take this forward in PIR  for now website is restored
213,21/11/2025 13:07,Maya,private-comms-6861,Alright since everything's back up and stable we can now move back to the main #online-boutique channel. No further actions left here
214,21/11/2025 13:07,Maya,online-boutique-6861,Do we go ahead and mark this incident as closed?
215,21/11/2025 13:07,player1,business-comms-6861,we will conducting a post incident review shortly and feed this back to you
216,21/11/2025 13:08,Bez,business-comms-6861,How is order metric looks now ?
217,21/11/2025 13:08,player1,private-comms-6861,incident resolved
218,21/11/2025 13:08,Maya,online-boutique-6861,@player1 is there anything pending ?
219,21/11/2025 13:08,Bez,business-comms-6861,Since services are restored I'm heading to speak with compliance and the regulators. Thankfully no data was leaked that helps
220,21/11/2025 13:08,Tanya,online-boutique-6861,That was intense. We've never been this close to total loss before. We got lucky
221,21/11/2025 13:08,Tinus,business-comms-6861,I'm on my way to the ICO (Information Commissioner's Office - UK) office now. I'll get the formal report rolling - that's required for the insurance claim. Keep monitoring in the meantime
222,21/11/2025 13:08,Daniel,online-boutique-6861,Systems are calm now but that feeling earlier... not something I want to go through again
223,21/11/2025 13:08,Bob,online-boutique-6861,One small slip caused a major breach. We need better awareness to prevent this in future
224,21/11/2025 13:08,Tinus,online-boutique-6861,This could've gone way worse. Appreciate how quickly and cleanly you handled it
225,21/11/2025 13:08,Bez,online-boutique-6861,Not every day we survive an attack like this. You made the right calls fast. Great job @player1 - that's how we bounce back
227,21/11/2025 13:09,player1,online-boutique-6861,Clicked Start_feedback button\n